{
  "$schema": "../schemas/call-window.schema.json",
  "schemaVersion": "1.0.0",
  "key": "muse-model-management:thu-1500",
  "organizationId": "muse-model-management",
  "agencyId": null,
  "displayName": "Muse Model Management",
  "label": "Walk-in open call",
  "weekday": 4,
  "startMinute": 900,
  "endMinute": 960,
  "timezone": "America/New_York",
  "location": null,
  "instructions": null,
  "sourceUrl": null,
  "verifiedOn": "2026-08-15",
  "active": true
}
