{
  "$schema": "../schemas/call-window.schema.json",
  "schemaVersion": "1.0.0",
  "key": "que-management:thu-1000",
  "organizationId": null,
  "agencyId": null,
  "displayName": "Que Management",
  "label": "Walk-in open call",
  "weekday": 4,
  "startMinute": 600,
  "endMinute": 660,
  "timezone": "America/New_York",
  "location": null,
  "instructions": null,
  "sourceUrl": null,
  "verifiedOn": "2026-08-15",
  "active": true
}
